source,command_or_observation,status,material_facts
https://huggingface.co/Qwen/Qwen3.6-27B-FP8,"web open",ok,"Model card resolves publicly; page documents SGLang serving for --model-path Qwen/Qwen3.6-27B-FP8."
https://huggingface.co/api/models/Qwen/Qwen3.6-27B-FP8,"curl -L -s https://huggingface.co/api/models/Qwen/Qwen3.6-27B-FP8 | python3 -m json.tool",ok,"private=false; author=Qwen; sha=e89b16ebf1988b3d6befa7de50abc2d76f26eb09; lastModified=2026-04-24T02:39:18.000Z; license=apache-2.0; downloads=7381555."
docs/evidence/whitepaper-provenance-20260601T175048Z/REPORT.md,"sed -n '1,240p'",ok,"Existing packet already supports May 2026/testnet/provenance claims and identifies dynamic-unl-scoring references as local evidence."
static/benchmarks/model-lift-baseline-20260601T154824Z/REPORT.md,"sed -n '1,220p'",ok,"Existing packet is a comparator audit, not an accuracy benchmark."
static/benchmarks/model-lift-adjudication-20260601T165516Z/REPORT.md,"sed -n '1,220p'",ok,"Existing packet says boundary disagreements are policy tradeoffs and do not prove model superiority."
